No,Question,GraphRAG Answer,FlatRAG Answer,GraphRAG Time(s),FlatRAG Time(s),GraphRAG Correct,FlatRAG Correct
1,Who founded OpenAI?,"OpenAI was founded by Sam Altman, Elon Musk, Greg Brockman, Ilya Sutskever, and Wojciech Zaremba.","OpenAI was founded by Sam Altman, Elon Musk, Greg Brockman, Ilya Sutskever, and Wojciech Zaremba.",46.08,0.89,,
2,Who founded DeepMind?,Demis Hassabis founded DeepMind.,"DeepMind was founded by Demis Hassabis, Shane Legg, and Mustafa Suleyman.",1.77,0.8,,
3,Who founded Anthropic?,Dario Amodei and Daniela Amodei founded Anthropic.,The context provided does not include information about the founders of Anthropic.,1.81,0.67,,
4,Who founded Mistral AI?,Not found in graph.,The context provided does not contain information about the founding of Mistral AI.,2.23,0.51,,
5,Who founded xAI?,Elon Musk founded xAI.,The context provided does not include information about the founding of xAI.,1.25,0.76,,
6,Which company is led by Sam Altman?,OpenAI.,OpenAI,1.91,0.61,,
7,Who is the CEO of Nvidia?,Jensen Huang is the CEO of Nvidia.,The context provided does not include information about Nvidia or its CEO.,1.6,1.05,,
8,Who leads Meta?,Mark Zuckerberg.,Mark Zuckerberg serves as the CEO and Chairman of Meta.,4.17,0.77,,
9,Who is the CEO of Google DeepMind?,Demis Hassabis.,The context does not provide information about the CEO of Google DeepMind.,2.0,0.66,,
10,Who invested in OpenAI?,"Microsoft, Nvidia, and Satya Nadella invested in OpenAI.",Microsoft invested one billion dollars in OpenAI.,45.72,0.74,,
11,Which companies did Google invest in?,Google invested in DeepMind.,The context provided does not specify any companies that Google invested in.,3.36,0.57,,
12,Who invested in Anthropic?,Google and Amazon.,The context provided does not contain any information about investments in Anthropic.,2.14,0.57,,
13,Who funded Mistral AI?,Mistral AI is funded by Andreessen Horowitz.,The context provided does not contain any information about who funded Mistral AI.,2.19,0.97,,
14,What products did OpenAI create?,OpenAI created ChatGPT.,OpenAI created GPT-4 and DALL-E.,31.3,0.96,,
15,What is Claude?,Claude is a product created by Anthropic.,The context provided does not contain any information about Claude.,1.1,0.78,,
16,What did Google DeepMind create?,Google DeepMind created AlphaGo and Gemini.,"Google DeepMind created AlphaGo, the first AI to defeat a world champion Go player, and developed Gemini, its most advanced AI model, released in December 2023.",1.44,0.98,,
17,What AI models does Meta have?,Meta has LLaMA.,"Meta has the LLaMA large language model, which was released as open-source in 2023. Additionally, Meta developed the PyTorch machine learning framework, which is widely used in AI research.",4.43,1.4,,
18,What did xAI create?,xAI created Grok.,"The context provided does not mention xAI or any creations associated with it. Therefore, I cannot provide an answer regarding what xAI created.",1.2,0.91,,
19,What is the relationship between Microsoft and OpenAI?,Microsoft partnered with OpenAI and invested in it.,"Microsoft and OpenAI have a deep partnership, with Microsoft investing in OpenAI and integrating its models into products like Bing, Azure, and Office 365. Microsoft initially invested one billion dollars in OpenAI in 2019 and further invested ten billion dollars in 2023.",108.7,1.02,,
20,Which companies does Alphabet own?,Alphabet owns Google.,The context does not provide information about which companies Alphabet owns.,1.1,0.73,,
21,What companies does Nvidia supply GPUs to?,"Nvidia supplies GPUs to OpenAI, Microsoft, and Anthropic.",The context provided does not include information about the companies that Nvidia supplies GPUs to.,1.67,0.91,,
22,Who competes with OpenAI?,"xAI, Mistral AI, and Safe Superintelligence compete with OpenAI.",Google and Meta compete with OpenAI.,31.34,0.95,,
23,What models compete with GPT-4?,"Gemini, LLaMA, Grok, Claude, and Mixtral compete with GPT-4.","Gemini, developed by Google DeepMind, is a model that competes with GPT-4.",1.01,0.8,,
24,What chips did Nvidia create?,Not found in graph.,The context provided does not mention any chips created by Nvidia.,1.4,0.72,,
25,What company did Ilya Sutskever found after leaving OpenAI?,"Ilya Sutskever founded Safe Superintelligence after leaving OpenAI. 

Final answer: Safe Superintelligence.",The context does not provide information about Ilya Sutskever founding any company after leaving OpenAI.,31.64,0.89,,
26,What did Daniela Amodei co-found?,Not found in graph.,"The context provided does not mention Daniela Amodei or any organization she may have co-founded. Therefore, I cannot provide an answer based on the given information.",1.88,0.87,,
27,What did Demis Hassabis found before joining Google?,Not found in graph.,Demis Hassabis founded DeepMind before joining Google.,3.27,0.84,,
28,What is Hugging Face known for?,Not found in graph.,"The provided context does not contain any information about Hugging Face. Therefore, I cannot answer the question based on the given context.",1.29,0.85,,
29,What is Copilot powered by?,Copilot is powered by GPT-4.,"Copilot is powered by AI, developed in partnership with OpenAI.",1.26,0.77,,
30,What is integrated in Microsoft Office?,"Copilot, Microsoft, OpenAI, Satya Nadella, and Nvidia are integrated in Microsoft Office.",OpenAI's models are integrated into Microsoft Office 365.,1.06,0.6,,
